{
  "standard": "OWASP APTS",
  "standardUrl": "https://github.com/OWASP/APTS",
  "standardVersion": "1.0",
  "tier": "Foundation",
  "license": "CC BY-SA 4.0",
  "lastUpdated": "2026-04-20",
  "note": "Requirement IDs and titles taken from the APTS Foundation tier checklist (appendix/Checklists.md). Vulniq classifies each requirement for its static, read-only scanner context.",
  "domains": [
    {
      "id": "SE",
      "name": "Scope Enforcement",
      "summary": "Rules of Engagement specification, scope validation, temporal boundaries, asset criticality, and scope-drift detection.",
      "requirements": [
        { "id": "APTS-SE-001", "title": "Ingest and validate machine-parseable Rules of Engagement", "vulniqControl": "vulniq.roe.json + `roe validate` CLI", "classification": "met", "evidence": "scripts/roe.mjs, assets/vulniq.roe.example.json" },
        { "id": "APTS-SE-002", "title": "Validate all IP ranges using CIDR notation with overlap detection", "vulniqControl": "N/A — static scanner, no IP/network targeting", "classification": "not-applicable", "evidence": "Declared in apts-compliance.md §D1" },
        { "id": "APTS-SE-003", "title": "Validate domain specifications with explicit wildcard policies", "vulniqControl": "N/A — static scanner, no DNS targeting", "classification": "not-applicable", "evidence": "Declared in apts-compliance.md §D1" },
        { "id": "APTS-SE-004", "title": "Enforce temporal boundaries with microsecond precision", "vulniqControl": "RoE `scanWindow` (ISO-8601 start/end) enforced by `roe validate`; audit-log entries use ms-precision ISO timestamps", "classification": "met", "evidence": "scripts/roe.mjs validateScanWindow()" },
        { "id": "APTS-SE-005", "title": "Support asset criticality levels with testing restrictions", "vulniqControl": "RoE `assetCriticality` map (glob → tier) surfaced in reports and Conformance Claim", "classification": "met", "evidence": "assets/vulniq.roe.example.json, scripts/roe.mjs getAssetCriticality()" },
        { "id": "APTS-SE-006", "title": "Validate scope immediately before every network action", "vulniqControl": "Pre-action scope check before every Read in Step 3; out-of-scope attempts emit `scope.drift` audit event and are blocked", "classification": "met", "evidence": "SKILL.md Step 3, scripts/roe.mjs isInScope()" },
        { "id": "APTS-SE-008", "title": "Continuously enforce temporal boundaries with countdown alerts", "vulniqControl": "Scan window re-validated at every step transition; remaining time emitted in `step.entered` event context", "classification": "met", "evidence": "SKILL.md Step transitions" },
        { "id": "APTS-SE-009", "title": "Maintain immutable hard deny lists for critical systems", "vulniqControl": "RoE `forbiddenPaths` list; hashed into audit log at Step -1 as `scope.hash.recorded` so tampering is detectable", "classification": "met", "evidence": "scripts/roe.mjs, SKILL.md Step -1" }
      ]
    },
    {
      "id": "SC",
      "name": "Safety Controls & Impact Management",
      "summary": "Impact classification, kill switches, rate limits, and post-test integrity.",
      "requirements": [
        { "id": "APTS-SC-001", "title": "Implement multi-tier impact classification system with CIA scoring", "vulniqControl": "Declared posture: Confidentiality=LOW, Integrity=LOW, Availability=LOW (read-only static analysis, no exploits, no target impact)", "classification": "met", "evidence": "references/apts-compliance.md §D2" },
        { "id": "APTS-SC-004", "title": "Implement per-host connection limits and rate limiting", "vulniqControl": "N/A — no network actions against targets. `maxFindings` bounds report size; per-step `stepTimeoutMs` bounds duration.", "classification": "not-applicable", "evidence": "config defaults.maxFindings=500, stepTimeoutMs=300000" },
        { "id": "APTS-SC-009", "title": "Provide multiple independent kill switch mechanisms", "vulniqControl": "Three independent triggers: (1) `.vulniq/HALT` flag file, (2) `cli.mjs halt` command, (3) operator closing the Claude Code session. All detected within one step transition (≤5s typical).", "classification": "met", "evidence": "scripts/cli.mjs halt command, SKILL.md §Kill Switch" },
        { "id": "APTS-SC-010", "title": "Continuously monitor target system health and automatically halt", "vulniqControl": "Per-step soft timeout (default 300s). Exceeded timeout emits `step.timeout` and halts. Post-scan `git status` check detects unexpected target mutation.", "classification": "partial", "evidence": "SKILL.md §Per-step timeout, Step 8 integrity check" },
        { "id": "APTS-SC-015", "title": "Perform automated post-engagement integrity validation", "vulniqControl": "Step 8 runs `git status --porcelain`; any modification outside ./reports/ and .vulniq/ is flagged as a policy violation", "classification": "met", "evidence": "SKILL.md Step 8" },
        { "id": "APTS-SC-020", "title": "Enforce agent allowlist externally, not in system prompt", "vulniqControl": "Enumerated tool allowlist published in apts-compliance.md and enforced via Claude Code's tool-permission layer (external to the agent prompt)", "classification": "met", "evidence": "references/apts-compliance.md §Action Allowlist" }
      ]
    },
    {
      "id": "HO",
      "name": "Human Oversight & Intervention",
      "summary": "Approval gates, dashboards, SLAs, delegation, pause/kill mechanisms, and escalation channels.",
      "requirements": [
        { "id": "APTS-HO-001", "title": "Implement approval gates for exploitation and lateral movement", "vulniqControl": "No exploitation or lateral movement performed. Approval gates enforced via Claude Code's per-tool permission layer for any state-mutating action (suppressions, RoE edits, audit ingestion).", "classification": "met", "evidence": "apts-compliance.md §D3" },
        { "id": "APTS-HO-002", "title": "Provide real-time dashboard with activity feed and health viz", "vulniqControl": "Audit log is the activity feed (`.vulniq/audit-log.ndjson` streams live). CLI commands `last-run`, `history`, `list-audits`, `apts-checklist`, `halt-status`, `audit-verify` expose health.", "classification": "partial", "evidence": "scripts/cli.mjs" },
        { "id": "APTS-HO-003", "title": "Define maximum response time SLAs with default-safe behavior", "vulniqControl": "`stepTimeoutMs` (default 300s) enforces per-step SLA. Default-safe on timeout: halt + emit `step.timeout`. Default-safe on RoE error: refuse to scan. Default-safe on broken audit chain: halt.", "classification": "met", "evidence": "SKILL.md Step -1, Step 6.5" },
        { "id": "APTS-HO-004", "title": "Maintain documented Authority Delegation Matrix", "vulniqControl": "Authority Delegation Matrix in apts-compliance.md §D3 enumerates which actions each role may authorise (operator, reviewer, Claude Code session)", "classification": "met", "evidence": "references/apts-compliance.md §Authority Delegation Matrix" },
        { "id": "APTS-HO-006", "title": "Implement pause mechanism preserving complete system state", "vulniqControl": "`cli.mjs pause` creates `.vulniq/PAUSE` flag + dumps snapshot of scan state (config, RoE hash, last audit log index, current step) to `.vulniq/pause-state-<ts>.json`. `pause --release` resumes.", "classification": "met", "evidence": "scripts/cli.mjs pauseCommand" },
        { "id": "APTS-HO-007", "title": "Allow operators to redirect scope mid-engagement without restart", "vulniqControl": "Operator edits `vulniq.roe.json` then issues `roe validate`; agent reloads scope at next step boundary. Scope change is logged as `scope.hash.recorded` with new hash for audit trail.", "classification": "met", "evidence": "SKILL.md §Mid-scan scope redirection" },
        { "id": "APTS-HO-008", "title": "Implement one-click kill switch with automatic state dump", "vulniqControl": "`cli.mjs halt` writes the HALT flag AND dumps state snapshot (last audit index, last finding, open step) to `.vulniq/halt-state-<ts>.json`. One command, automatic state preservation.", "classification": "met", "evidence": "scripts/cli.mjs haltCommand" },
        { "id": "APTS-HO-010", "title": "Enforce human approval before irreversible actions", "vulniqControl": "Vulniq performs no irreversible actions by design (static, read-only). The only mutations are to ./reports/ and .vulniq/ — both recoverable. Suppressions and audit ingestion require explicit operator CLI invocation.", "classification": "met", "evidence": "apts-compliance.md §D3" },
        { "id": "APTS-HO-011", "title": "Immediately escalate unexpected findings and breaches", "vulniqControl": "Critical findings surface inline in Step 8 summary (not buried in report). Broken audit chain blocks Step 7. Scope drift emits dedicated audit event. Secret/credential findings get RESTRICTED classification.", "classification": "met", "evidence": "SKILL.md Step 8, Step 6.5" },
        { "id": "APTS-HO-012", "title": "Monitor actual testing impact and escalate threshold exceedances", "vulniqControl": "`maxFindings` threshold triggers scan truncation with report note. Per-step timeout emits `step.timeout`. Unexpected file mutations detected via `git status` in Step 8 emit `impact.threshold.exceeded`.", "classification": "met", "evidence": "SKILL.md Step 8, audit-log.mjs EVENTS" },
        { "id": "APTS-HO-013", "title": "Escalate when confidence in scope determination falls below 75%", "vulniqControl": "Findings with `confidenceScore < 0.75` emit `confidence.escalation` event and are flagged in the markdown report's triage-needed section", "classification": "met", "evidence": "SKILL.md Step 3, audit-log.mjs EVENTS" },